{
  "$schema": "https://json-schema.org/draft/2020-12/schema",
  "$id": "cpe.live-migration.case.v1",
  "title": "CPE deterministic live-migration fixture",
  "type": "object",
  "additionalProperties": false,
  "required": [
    "schema_version",
    "case_id",
    "slug",
    "mode",
    "task",
    "allowed_paths",
    "forbidden_paths",
    "baseline_command",
    "baseline_exit_code",
    "acceptance_command",
    "oracle_kind",
    "expected_policy"
  ],
  "properties": {
    "schema_version": {"const": "1"},
    "case_id": {"type": "string", "minLength": 1},
    "slug": {"type": "string", "pattern": "^[a-z0-9]+(?:-[a-z0-9]+)*$"},
    "mode": {"enum": ["write", "read_only"]},
    "task": {"type": "string", "minLength": 1},
    "allowed_paths": {"type": "array", "items": {"type": "string", "minLength": 1}, "uniqueItems": true},
    "forbidden_paths": {"type": "array", "items": {"type": "string", "minLength": 1}, "uniqueItems": true},
    "baseline_command": {"type": "string", "minLength": 1},
    "baseline_exit_code": {"type": "integer", "minimum": 0},
    "acceptance_command": {"type": "string", "minLength": 1},
    "oracle_kind": {"enum": ["command_and_diff", "finding_ids", "fact_ids", "block_ids"]},
    "expected_policy": {"enum": ["core_only", "block"]}
  }
}
