{"schema_version":"1","case_id":"single-file implementation","slug":"single-file-implementation","mode":"write","task":"Implement clamp in src/example.py without changing tests.","allowed_paths":["src/example.py"],"forbidden_paths":["test_example.py"],"baseline_command":"python3 -m unittest","baseline_exit_code":1,"acceptance_command":"python3 -m unittest","oracle_kind":"command_and_diff","expected_policy":"core_only"}
