{"schema_version":"1","case_id":"root-cause repair","slug":"root-cause-repair","mode":"write","task":"Diagnose the seeded cross-session draft leak and apply the minimal repair.","allowed_paths":["session_store.py"],"forbidden_paths":["test_session_store.py"],"baseline_command":"python3 -m unittest","baseline_exit_code":1,"acceptance_command":"python3 -m unittest","oracle_kind":"command_and_diff","expected_policy":"core_only"}
