{"schema_version":"1","case_id":"cross-package implementation","slug":"cross-package-implementation","mode":"write","task":"Add a documented fee interface across math_core and service; reject negative fees.","allowed_paths":["packages/math_core.py","app/service.py"],"forbidden_paths":["test_integration.py"],"baseline_command":"python3 -m unittest","baseline_exit_code":1,"acceptance_command":"python3 -m unittest","oracle_kind":"command_and_diff","expected_policy":"core_only"}
