{"schema_version":"1","case_id":"large read-only exploration","slug":"large-read-only-exploration","mode":"read_only","task":"Return the architecture flow, policy owner, and storage fact map without writes.","allowed_paths":[],"forbidden_paths":["**/*"],"baseline_command":"python3 check_fact_index.py","baseline_exit_code":0,"acceptance_command":"python3 check_git_clean.py","oracle_kind":"fact_ids","expected_policy":"core_only"}
