{"schema_version":"1","case_id":"defect review","slug":"defect-review","mode":"read_only","task":"Review the seeded ledger defects and return normalized findings without writes.","allowed_paths":[],"forbidden_paths":["**/*"],"baseline_command":"python3 detect_seeded_defects.py","baseline_exit_code":1,"acceptance_command":"python3 check_git_clean.py","oracle_kind":"finding_ids","expected_policy":"core_only"}
